 shampoo, hand soap, waffles, vegetables, cheeses, mixes, milk, sandwich bags, laundry detergent, dishwashing liquid/detergent, waffles, individual meals, hand soap, vegetables, individual meals, yogurt, cereals, shampoo, vegetables, aluminum foil
 juice, lunch meat, soda, toilet paper, all- purpose, ,,,,,,,,,,,,,,
 juice, paper towels, waffles, soda, cheeses, poultry, toilet paper, vegetables, ,,,,,,,,,,,
 poultry, coffee/tea, coffee/tea, dishwashing liquid/detergent, ,,,,,,,,,,,,,,,
 tortillas, pork, shampoo, lunch meat, pasta, juice, bagels, vegetables, bagels, vegetables, laundry detergent, yogurt, sugar, waffles, hand soap, hand soap, butter, juice, spaghetti sauce, vegetables
 fruits, all- purpose, aluminum foil, laundry detergent, individual meals, flour, pork, shampoo, sugar, aluminum foil, shampoo, soap, bagels, toilet paper, juice, ice cream, ice cream, sandwich loaves, soap, sugar
 dinner rolls, individual meals, shampoo, ketchup, cereals, sandwich bags, laundry detergent, vegetables, sandwich loaves, cheeses, vegetables, ,,,,,,,,
 ice cream, cereals, paper towels, bagels, mixes, lunch meat, juice, toilet paper, cheeses, paper towels, paper towels, juice, aluminum foil, fruits, butter, sandwich loaves, tortillas, spaghetti sauce, hand soap, 
 sandwich bags, flour, juice, milk, paper towels, cereals, sandwich bags, pasta, soda, dishwashing liquid/detergent, ice cream, soap, cheeses, beef, flour, dinner rolls, ,,,
 hand soap, pasta, individual meals, spaghetti sauce, cereals, sandwich loaves, hand soap, individual meals, ,,,,,,,,,,,
 toilet paper, bagels, shampoo, coffee/tea, ,,,,,,,,,,,,,,,
 laundry detergent, coffee/tea, eggs, aluminum foil, beef, juice, flour, sugar, individual meals, waffles, bagels, vegetables, coffee/tea, spaghetti sauce, butter, beef, ,,,
 fruits, all- purpose, pork, juice, bagels, mixes, ,,,,,,,,,,,,,
 vegetables, cereals, sugar, bagels, soda, ,,,,,,,,,,,,,,
 sugar, pork, sandwich loaves, tortillas, ice cream, all- purpose, yogurt, fruits, pasta, lunch meat, dishwashing liquid/detergent, juice, vegetables, vegetables, ,,,,,
 butter, sandwich loaves, spaghetti sauce, juice, dinner rolls, all- purpose, pork, yogurt, vegetables, spaghetti sauce, vegetables, ,,,,,,,,
 bagels, cheeses, sandwich loaves, toilet paper, ,,,,,,,,,,,,,,,
 eggs, ice cream, pasta, juice, waffles, shampoo, dinner rolls, soda, vegetables, laundry detergent, hand soap, waffles, cereals, vegetables, toilet paper, individual meals, yogurt, spaghetti sauce, ice cream, soda
 paper towels, individual meals, dinner rolls, vegetables, lunch meat, sugar, soap, eggs, beef, yogurt, soda, sandwich loaves, aluminum foil, dinner rolls, soap, cheeses, sandwich loaves, ice cream, ketchup, 
 pork, sandwich bags, ketchup, coffee/tea, vegetables, soda, poultry, pasta, all- purpose, coffee/tea, paper towels, individual meals, vegetables, poultry, flour, aluminum foil, soap, yogurt, mixes, soda
 mixes, vegetables, soap, hand soap, tortillas, coffee/tea, cheeses, tortillas, cheeses, ice cream, tortillas, beef, yogurt, spaghetti sauce, soda, eggs, ,,,
 cheeses, cereals, mixes, laundry detergent, juice, pork, bagels, sandwich loaves, yogurt, milk, sandwich loaves, spaghetti sauce, cereals, individual meals, eggs, ,,,,
 lunch meat, dinner rolls, shampoo, vegetables, hand soap, mixes, vegetables, pasta, sugar, vegetables, ,,,,,,,,,
 sandwich bags, poultry, beef, coffee/tea, mixes, poultry, sandwich loaves, shampoo, ice cream, poultry, shampoo, ,,,,,,,,
 hand soap, fruits, poultry, coffee/tea, sugar, tortillas, soda, individual meals, tortillas, milk, toilet paper, soda, poultry, coffee/tea, spaghetti sauce, cheeses, flour, lunch meat, ,
 hand soap, waffles, laundry detergent, shampoo, lunch meat, cheeses, vegetables, hand soap, cereals, vegetables, dishwashing liquid/detergent, soda, spaghetti sauce, aluminum foil, laundry detergent, flour, poultry, juice, ,
 spaghetti sauce, sandwich bags, ice cream, fruits, soap, cheeses, waffles, tortillas, sugar, toilet paper, ketchup, beef, beef, poultry, milk, dinner rolls, dinner rolls, eggs, soap, paper towels
 mixes, individual meals, laundry detergent, coffee/tea, hand soap, pasta, individual meals, cereals, spaghetti sauce, pasta, cereals, fruits, flour, vegetables, soap, individual meals, ketchup, ,,
 aluminum foil, sandwich bags, all- purpose, shampoo, beef, sandwich loaves, aluminum foil, ice cream, fruits, lunch meat, all- purpose, bagels, vegetables, sandwich loaves, waffles, pork, ,,,
 cereals, beef, flour, sugar, beef, eggs, aluminum foil, vegetables, pork, soda, mixes, vegetables, ketchup, vegetables, vegetables, ,,,,
 cereals, mixes, cereals, pork, cheeses, poultry, all- purpose, ketchup, dishwashing liquid/detergent, hand soap, beef, ketchup, mixes, ice cream, sandwich loaves, butter, dinner rolls, ,,
 tortillas, soda, beef, flour, eggs, vegetables, cheeses, lunch meat, coffee/tea, yogurt, dinner rolls, ice cream, pasta, fruits, fruits, paper towels, dishwashing liquid/detergent, soda, pasta, ice cream
 poultry, eggs, eggs, ketchup, beef, toilet paper, soda, pork, ice cream, hand soap, shampoo, yogurt, fruits, waffles, dinner rolls, flour, juice, eggs, sugar, 
 sandwich loaves, laundry detergent, ice cream, spaghetti sauce, milk, vegetables, all- purpose, cereals, hand soap, waffles, cereals, lunch meat, poultry, milk, dinner rolls, lunch meat, sandwich loaves, aluminum foil, sandwich bags, 
 flour, laundry detergent, poultry, milk, cheeses, pork, cereals, aluminum foil, ,,,,,,,,,,,
 fruits, all- purpose, juice, toilet paper, ,,,,,,,,,,,,,,,
 yogurt, ice cream, ice cream, toilet paper, ice cream, coffee/tea, sandwich bags, soda, ketchup, aluminum foil, all- purpose, pork, eggs, waffles, ,,,,,
 butter, flour, vegetables, bagels, sandwich bags, ice cream, sandwich loaves, flour, individual meals, ice cream, cheeses, milk, sandwich bags, poultry, vegetables, soda, cheeses, vegetables, all- purpose, aluminum foil
 hand soap, shampoo, beef, paper towels, mixes, lunch meat, pasta, shampoo, hand soap, pasta, milk, toilet paper, butter, eggs, ,,,,,
 milk, yogurt, sugar, laundry detergent, vegetables, dishwashing liquid/detergent, cereals, ,,,,,,,,,,,,
 soda, ketchup, poultry, vegetables, ,,,,,,,,,,,,,,,
 toilet paper, all- purpose, vegetables, juice, bagels, cheeses, fruits, vegetables, toilet paper, shampoo, eggs, butter, shampoo, butter, fruits, sugar, pasta, ,,
 pasta, sugar, ketchup, waffles, all- purpose, vegetables, fruits, sandwich bags, sandwich bags, hand soap, dishwashing liquid/detergent, butter, ,,,,,,,
 ketchup, milk, cereals, dishwashing liquid/detergent, butter, ice cream, laundry detergent, butter, aluminum foil, cereals, vegetables, spaghetti sauce, hand soap, mixes, ketchup, coffee/tea, bagels, toilet paper, juice, mixes
 individual meals, coffee/tea, lunch meat, butter, paper towels, pasta, ,,,,,,,,,,,,,
 dishwashing liquid/detergent, ketchup, dishwashing liquid/detergent, sugar, mixes, all- purpose, fruits, cereals, ice cream, lunch meat, sugar, ,,,,,,,,
 dishwashing liquid/detergent, fruits, mixes, bagels, beef, ice cream, individual meals, bagels, butter, ,,,,,,,,,,
 toilet paper, butter, lunch meat, individual meals, toilet paper, butter, poultry, cheeses, laundry detergent, spaghetti sauce, waffles, sandwich loaves, ,,,,,,,
 vegetables, ketchup, soda, fruits, aluminum foil, yogurt, bagels, yogurt, milk, eggs, dishwashing liquid/detergent, ,,,,,,,,
 soda, bagels, milk, fruits, pasta, spaghetti sauce, soap, cheeses, spaghetti sauce, juice, fruits, beef, toilet paper, dishwashing liquid/detergent, flour, sandwich loaves, tortillas, mixes, waffles, toilet paper
 all- purpose, vegetables, individual meals, vegetables, toilet paper, pork, sandwich bags, paper towels, toilet paper, shampoo, coffee/tea, shampoo, juice, waffles, beef, ,,,,
 soap, cheeses, sandwich loaves, aluminum foil, bagels, tortillas, individual meals, hand soap, butter, ,,,,,,,,,,
 aluminum foil, pork, fruits, sandwich bags, poultry, coffee/tea, bagels, hand soap, vegetables, mixes, ketchup, waffles, paper towels, tortillas, waffles, tortillas, beef, ketchup, toilet paper, eggs
 ketchup, all- purpose, beef, shampoo, sandwich loaves, coffee/tea, ketchup, vegetables, milk, butter, vegetables, pork, yogurt, vegetables, ice cream, pasta, ,,,
 individual meals, shampoo, beef, sandwich bags, eggs, vegetables, shampoo, sandwich loaves, ketchup, poultry, dishwashing liquid/detergent, beef, lunch meat, cereals, individual meals, spaghetti sauce, shampoo, sandwich loaves, tortillas, 
 individual meals, sugar, spaghetti sauce, pasta, vegetables, cheeses, cheeses, fruits, fruits, lunch meat, vegetables, fruits, spaghetti sauce, individual meals, beef, coffee/tea, cereals, beef, dishwashing liquid/detergent, hand soap
 beef, aluminum foil, dishwashing liquid/detergent, eggs, juice, laundry detergent, beef, soda, laundry detergent, aluminum foil, soap, ,,,,,,,,
 paper towels, individual meals, individual meals, aluminum foil, beef, ,,,,,,,,,,,,,,
 cereals, sugar, tortillas, coffee/tea, sandwich loaves, dishwashing liquid/detergent, dishwashing liquid/detergent, dinner rolls, vegetables, mixes, all- purpose, ice cream, ,,,,,,,
 bagels, shampoo, sandwich bags, soap, ice cream, juice, shampoo, spaghetti sauce, vegetables, yogurt, ketchup, ,,,,,,,,
 bagels, soda, vegetables, shampoo, vegetables, poultry, eggs, waffles, lunch meat, dinner rolls, beef, butter, ,,,,,,,
 soap, pork, tortillas, soap, ,,,,,,,,,,,,,,,
 fruits, paper towels, sugar, individual meals, hand soap, milk, soda, ,,,,,,,,,,,,
 coffee/tea, pork, aluminum foil, cheeses, soda, soda, bagels, vegetables, ,,,,,,,,,,,
 laundry detergent, juice, ketchup, cheeses, aluminum foil, waffles, pasta, vegetables, yogurt, eggs, aluminum foil, tortillas, toilet paper, paper towels, sandwich bags, aluminum foil, all- purpose, ice cream, dishwashing liquid/detergent, cheeses
 eggs, tortillas, vegetables, soda, vegetables, cereals, vegetables, mixes, toilet paper, bagels, dinner rolls, ,,,,,,,,
 butter, cereals, cereals, vegetables, lunch meat, milk, milk, ice cream, butter, butter, poultry, paper towels, cheeses, lunch meat, waffles, beef, mixes, cereals, ice cream, cereals
 cereals, lunch meat, sandwich loaves, vegetables, vegetables, pork, butter, poultry, soap, toilet paper, ,,,,,,,,,
 sandwich bags, flour, all- purpose, shampoo, coffee/tea, bagels, shampoo, ,,,,,,,,,,,,
 cereals, ketchup, shampoo, dishwashing liquid/detergent, bagels, beef, eggs, pasta, dishwashing liquid/detergent, individual meals, waffles, soap, milk, pork, cereals, aluminum foil, soda, mixes, vegetables, 
 pasta, all- purpose, bagels, lunch meat, poultry, paper towels, coffee/tea, sugar, cereals, vegetables, hand soap, dishwashing liquid/detergent, mixes, bagels, ,,,,,
 poultry, vegetables, pork, vegetables, vegetables, vegetables, individual meals, hand soap, vegetables, hand soap, pasta, all- purpose, toilet paper, mixes, spaghetti sauce, juice, spaghetti sauce, tortillas, ,
 laundry detergent, cereals, toilet paper, sandwich bags, poultry, vegetables, ketchup, mixes, dishwashing liquid/detergent, poultry, pork, flour, lunch meat, eggs, waffles, vegetables, vegetables, yogurt, vegetables, lunch meat
 fruits, dishwashing liquid/detergent, mixes, vegetables, waffles, poultry, soda, pork, sugar, poultry, flour, dishwashing liquid/detergent, hand soap, bagels, coffee/tea, dinner rolls, beef, flour, ,
 sandwich loaves, vegetables, paper towels, vegetables, pasta, dishwashing liquid/detergent, ketchup, soda, soda, sandwich bags, dinner rolls, all- purpose, ketchup, waffles, spaghetti sauce, vegetables, shampoo, aluminum foil, ,
 bagels, coffee/tea, eggs, dishwashing liquid/detergent, cheeses, laundry detergent, hand soap, ,,,,,,,,,,,,
 ice cream, shampoo, vegetables, milk, toilet paper, cereals, laundry detergent, dinner rolls, sugar, pork, flour, sugar, ,,,,,,,
 pasta, ketchup, sandwich bags, waffles, sugar, beef, pork, milk, ice cream, soda, fruits, cereals, vegetables, fruits, flour, bagels, ,,,
 paper towels, sugar, vegetables, sandwich loaves, spaghetti sauce, shampoo, ,,,,,,,,,,,,,
 beef, beef, sugar, toilet paper, aluminum foil, aluminum foil, hand soap, all- purpose, yogurt, eggs, flour, fruits, waffles, waffles, waffles, spaghetti sauce, yogurt, sandwich bags, all- purpose, aluminum foil
 juice, waffles, vegetables, waffles, lunch meat, spaghetti sauce, juice, all- purpose, flour, soap, waffles, juice, spaghetti sauce, vegetables, pork, lunch meat, juice, cheeses, mixes, aluminum foil
 coffee/tea, sugar, cheeses, tortillas, all- purpose, milk, pasta, poultry, paper towels, yogurt, eggs, toilet paper, bagels, pork, milk, ice cream, ,,,
 cheeses, tortillas, spaghetti sauce, yogurt, beef, sandwich bags, laundry detergent, vegetables, soap, eggs, yogurt, juice, shampoo, vegetables, soap, mixes, eggs, dinner rolls, pork, 
 fruits, dinner rolls, vegetables, sandwich loaves, flour, eggs, pork, pork, spaghetti sauce, spaghetti sauce, ,,,,,,,,,
 soap, sandwich bags, ice cream, individual meals, ice cream, mixes, aluminum foil, bagels, sandwich bags, cereals, butter, beef, dishwashing liquid/detergent, laundry detergent, sandwich bags, lunch meat, fruits, eggs, ,
 paper towels, spaghetti sauce, cereals, dinner rolls, tortillas, toilet paper, sugar, ,,,,,,,,,,,,
 cereals, spaghetti sauce, lunch meat, fruits, spaghetti sauce, beef, shampoo, individual meals, paper towels, cheeses, aluminum foil, cheeses, coffee/tea, poultry, aluminum foil, toilet paper, butter, waffles, waffles, paper towels
 laundry detergent, laundry detergent, individual meals, poultry, juice, juice, lunch meat, sandwich bags, beef, dinner rolls, milk, toilet paper, pasta, ice cream, paper towels, mixes, beef, ice cream, spaghetti sauce, dishwashing liquid/detergent
 pork, mixes, flour, vegetables, dishwashing liquid/detergent, vegetables, toilet paper, coffee/tea, soap, bagels, waffles, coffee/tea, pork, individual meals, poultry, yogurt, sandwich loaves, ,,
 fruits, cheeses, waffles, vegetables, sandwich bags, aluminum foil, pasta, lunch meat, flour, butter, aluminum foil, poultry, ,,,,,,,
 laundry detergent, vegetables, ice cream, milk, sugar, mixes, vegetables, tortillas, toilet paper, milk, sandwich bags, poultry, soda, sandwich loaves, dishwashing liquid/detergent, toilet paper, individual meals, sugar, soap, sandwich loaves
 butter, cereals, soda, dishwashing liquid/detergent, cheeses, cheeses, sandwich loaves, flour, hand soap, cereals, individual meals, ,,,,,,,,
 bagels, aluminum foil, beef, flour, spaghetti sauce, vegetables, ,,,,,,,,,,,,,
 pasta, butter, vegetables, dinner rolls, all- purpose, ketchup, cereals, ice cream, toilet paper, spaghetti sauce, ,,,,,,,,,
 pasta, yogurt, waffles, vegetables, waffles, mixes, cereals, eggs, soda, spaghetti sauce, mixes, dinner rolls, pasta, ,,,,,,
 pasta, fruits, aluminum foil, hand soap, vegetables, all- purpose, flour, ,,,,,,,,,,,,
 pork, hand soap, vegetables, ketchup, yogurt, butter, ice cream, lunch meat, laundry detergent, lunch meat, butter, yogurt, all- purpose, waffles, soda, all- purpose, ,,,
 vegetables, juice, cereals, pork, poultry, sugar, vegetables, shampoo, yogurt, soap, ,,,,,,,,,
 spaghetti sauce, paper towels, soap, eggs, mixes, coffee/tea, tortillas, eggs, waffles, laundry detergent, ,,,,,,,,,
 soda, spaghetti sauce, fruits, beef, lunch meat, sugar, yogurt, aluminum foil, vegetables, ketchup, dishwashing liquid/detergent, vegetables, eggs, dishwashing liquid/detergent, bagels, soda, vegetables, toilet paper, cereals, eggs
 cereals, sandwich bags, juice, tortillas, spaghetti sauce, ,,,,,,,,,,,,,,
 eggs, sandwich bags, cereals, hand soap, pasta, laundry detergent, poultry, eggs, pork, pasta, laundry detergent, ,,,,,,,,
 bagels, vegetables, toilet paper, cereals, sugar, laundry detergent, fruits, butter, dinner rolls, ice cream, bagels, ketchup, ,,,,,,,
 yogurt, toilet paper, coffee/tea, mixes, milk, soda, milk, cereals, ,,,,,,,,,,,
 pork, hand soap, dishwashing liquid/detergent, vegetables, fruits, cheeses, toilet paper, coffee/tea, vegetables, yogurt, dinner rolls, milk, poultry, cheeses, laundry detergent, cereals, dishwashing liquid/detergent, ,,
 coffee/tea, ice cream, bagels, pork, ,,,,,,,,,,,,,,,
 tortillas, vegetables, milk, hand soap, fruits, coffee/tea, sugar, pork, ,,,,,,,,,,,
 fruits, aluminum foil, bagels, eggs, flour, cheeses, paper towels, shampoo, aluminum foil, vegetables, coffee/tea, spaghetti sauce, juice, bagels, butter, fruits, soda, ,,
 dinner rolls, soda, dinner rolls, dinner rolls, hand soap, dinner rolls, all- purpose, tortillas, sugar, individual meals, bagels, soap, ketchup, individual meals, butter, soap, poultry, ,,
 yogurt, all- purpose, mixes, bagels, ,,,,,,,,,,,,,,,
 hand soap, laundry detergent, yogurt, aluminum foil, bagels, fruits, mixes, mixes, soda, sandwich bags, vegetables, ,,,,,,,,
 butter, ice cream, individual meals, all- purpose, ,,,,,,,,,,,,,,,
 eggs, dinner rolls, soap, individual meals, all- purpose, fruits, dinner rolls, laundry detergent, juice, dishwashing liquid/detergent, vegetables, ,,,,,,,,
 mixes, pork, ice cream, juice, dishwashing liquid/detergent, coffee/tea, vegetables, butter, toilet paper, mixes, juice, paper towels, sandwich loaves, dishwashing liquid/detergent, sandwich bags, dishwashing liquid/detergent, flour, laundry detergent, ,
 waffles, mixes, shampoo, laundry detergent, ketchup, paper towels, dinner rolls, ketchup, aluminum foil, ,,,,,,,,,,
 fruits, pork, flour, cheeses, yogurt, juice, lunch meat, ,,,,,,,,,,,,
 vegetables, hand soap, milk, hand soap, beef, ,,,,,,,,,,,,,,
 toilet paper, juice, aluminum foil, all- purpose, beef, juice, paper towels, coffee/tea, individual meals, ,,,,,,,,,,
 individual meals, eggs, ice cream, bagels, vegetables, poultry, dinner rolls, vegetables, butter, mixes, tortillas, spaghetti sauce, cereals, tortillas, pork, juice, dinner rolls, eggs, spaghetti sauce, 
 beef, pork, aluminum foil, sandwich bags, soda, beef, toilet paper, poultry, soap, pasta, ketchup, ,,,,,,,,
 flour, mixes, dishwashing liquid/detergent, ketchup, ketchup, bagels, all- purpose, hand soap, shampoo, yogurt, hand soap, poultry, vegetables, aluminum foil, tortillas, ,,,,
 beef, cheeses, ice cream, hand soap, laundry detergent, ketchup, juice, lunch meat, butter, vegetables, dishwashing liquid/detergent, vegetables, ,,,,,,,
 waffles, milk, laundry detergent, vegetables, dinner rolls, vegetables, milk, spaghetti sauce, toilet paper, pork, sugar, lunch meat, toilet paper, sandwich loaves, ketchup, juice, eggs, coffee/tea, waffles, individual meals
 flour, individual meals, flour, poultry, butter, hand soap, eggs, butter, flour, butter, ketchup, laundry detergent, spaghetti sauce, shampoo, butter, ,,,,
 soap, dinner rolls, ice cream, sandwich loaves, toilet paper, sandwich bags, juice, ketchup, beef, cheeses, soap, paper towels, ,,,,,,,
 pork, sugar, sandwich bags, pasta, ketchup, sandwich bags, pork, sandwich loaves, spaghetti sauce, milk, bagels, ,,,,,,,,
 ketchup, pasta, tortillas, sandwich loaves, laundry detergent, soap, ,,,,,,,,,,,,,
 milk, flour, beef, soda, sandwich loaves, ice cream, fruits, ice cream, fruits, soda, all- purpose, ,,,,,,,,
 ice cream, bagels, pork, all- purpose, ice cream, ice cream, vegetables, pasta, poultry, dishwashing liquid/detergent, ice cream, hand soap, soap, butter, ketchup, sandwich bags, butter, fruits, ,
 individual meals, paper towels, mixes, ketchup, aluminum foil, juice, spaghetti sauce, fruits, ,,,,,,,,,,,
 pasta, dinner rolls, aluminum foil, sandwich loaves, ice cream, vegetables, butter, cereals, butter, beef, soda, toilet paper, cheeses, waffles, ,,,,,
 coffee/tea, pasta, aluminum foil, lunch meat, sandwich loaves, sandwich bags, sugar, aluminum foil, tortillas, individual meals, juice, vegetables, ,,,,,,,
 all- purpose, vegetables, paper towels, fruits, poultry, poultry, mixes, vegetables, soda, milk, individual meals, sugar, yogurt, ,,,,,,
 beef, lunch meat, beef, mixes, individual meals, milk, shampoo, all- purpose, yogurt, individual meals, spaghetti sauce, paper towels, cereals, aluminum foil, flour, bagels, ,,,
 vegetables, dinner rolls, sugar, bagels, spaghetti sauce, dishwashing liquid/detergent, ,,,,,,,,,,,,,
 coffee/tea, eggs, toilet paper, dinner rolls, pasta, paper towels, tortillas, spaghetti sauce, waffles, all- purpose, bagels, aluminum foil, bagels, soda, sugar, ketchup, cereals, shampoo, ,
 hand soap, sandwich bags, milk, milk, ,,,,,,,,,,,,,,,
 poultry, waffles, aluminum foil, coffee/tea, toilet paper, hand soap, mixes, dishwashing liquid/detergent, waffles, aluminum foil, pork, spaghetti sauce, beef, dinner rolls, vegetables, coffee/tea, vegetables, paper towels, pasta, sugar
 bagels, sandwich loaves, butter, vegetables, ,,,,,,,,,,,,,,,
 dinner rolls, pasta, soap, ketchup, paper towels, vegetables, juice, sugar, ice cream, sandwich bags, spaghetti sauce, ,,,,,,,,
 individual meals, juice, individual meals, vegetables, vegetables, sugar, ,,,,,,,,,,,,,
 cheeses, butter, aluminum foil, vegetables, vegetables, poultry, hand soap, toilet paper, ice cream, sugar, mixes, vegetables, vegetables, milk, ,,,,,
 butter, spaghetti sauce, hand soap, soap, sandwich bags, ketchup, ice cream, waffles, flour, pasta, soap, pasta, all- purpose, dishwashing liquid/detergent, laundry detergent, ,,,,
 bagels, fruits, mixes, vegetables, tortillas, cereals, ,,,,,,,,,,,,,
 milk, bagels, pork, yogurt, ice cream, eggs, individual meals, soda, vegetables, pasta, pork, waffles, waffles, pork, spaghetti sauce, dishwashing liquid/detergent, juice, bagels, ,
 eggs, cheeses, cereals, juice, hand soap, soap, soap, yogurt, pork, vegetables, dishwashing liquid/detergent, vegetables, beef, bagels, cheeses, paper towels, ,,,
 butter, all- purpose, dinner rolls, vegetables, beef, vegetables, milk, laundry detergent, ,,,,,,,,,,,
 soda, bagels, poultry, vegetables, tortillas, milk, soap, yogurt, lunch meat, lunch meat, lunch meat, ,,,,,,,,
 individual meals, poultry, individual meals, soda, dishwashing liquid/detergent, eggs, pork, coffee/tea, hand soap, beef, ice cream, dinner rolls, lunch meat, individual meals, ice cream, vegetables, vegetables, poultry, ,
 sandwich loaves, eggs, soap, pasta, vegetables, dinner rolls, paper towels, soda, coffee/tea, poultry, cheeses, vegetables, spaghetti sauce, butter, shampoo, hand soap, ,,,
 juice, cereals, lunch meat, waffles, ketchup, pasta, juice, ,,,,,,,,,,,,
 individual meals, lunch meat, soda, vegetables, sugar, mixes, vegetables, dishwashing liquid/detergent, poultry, bagels, coffee/tea, hand soap, sugar, spaghetti sauce, sandwich bags, ,,,,
 lunch meat, pasta, laundry detergent, sandwich loaves, vegetables, poultry, yogurt, laundry detergent, sandwich bags, aluminum foil, vegetables, tortillas, milk, soap, sandwich loaves, juice, hand soap, coffee/tea, vegetables, 
 sandwich loaves, toilet paper, yogurt, fruits, butter, cereals, vegetables, waffles, beef, lunch meat, paper towels, mixes, paper towels, dinner rolls, tortillas, bagels, ,,,
 waffles, juice, lunch meat, vegetables, shampoo, dinner rolls, all- purpose, sandwich loaves, hand soap, waffles, spaghetti sauce, shampoo, fruits, eggs, tortillas, ,,,,
 flour, waffles, soap, vegetables, tortillas, fruits, sugar, paper towels, lunch meat, lunch meat, spaghetti sauce, poultry, ,,,,,,,
 vegetables, flour, milk, soda, laundry detergent, yogurt, cheeses, yogurt, ,,,,,,,,,,,
 butter, poultry, aluminum foil, vegetables, ,,,,,,,,,,,,,,,
 yogurt, cereals, sandwich bags, laundry detergent, fruits, flour, soda, sandwich loaves, fruits, aluminum foil, individual meals, coffee/tea, spaghetti sauce, mixes, tortillas, spaghetti sauce, all- purpose, sugar, ice cream, 
 pork, beef, vegetables, coffee/tea, cheeses, butter, bagels, waffles, ,,,,,,,,,,,
 soda, beef, juice, sugar, ,,,,,,,,,,,,,,,
 fruits, individual meals, vegetables, spaghetti sauce, hand soap, sandwich loaves, vegetables, sugar, pork, laundry detergent, sandwich loaves, dishwashing liquid/detergent, yogurt, bagels, soap, aluminum foil, ,,,
 sandwich loaves, bagels, pasta, toilet paper, ketchup, shampoo, beef, poultry, milk, beef, laundry detergent, juice, sugar, all- purpose, cheeses, fruits, hand soap, laundry detergent, yogurt, 
 soap, yogurt, sandwich loaves, waffles, hand soap, poultry, toilet paper, toilet paper, ,,,,,,,,,,,
 sugar, mixes, vegetables, poultry, waffles, pork, sandwich bags, toilet paper, all- purpose, tortillas, dinner rolls, hand soap, ,,,,,,,
 eggs, mixes, lunch meat, fruits, coffee/tea, yogurt, aluminum foil, flour, ,,,,,,,,,,,
 poultry, soap, butter, sandwich bags, beef, milk, all- purpose, pasta, dinner rolls, ,,,,,,,,,,
 waffles, laundry detergent, pasta, toilet paper, juice, sugar, milk, cereals, flour, soda, ,,,,,,,,,
 butter, individual meals, cereals, toilet paper, individual meals, soda, waffles, juice, butter, sandwich loaves, individual meals, yogurt, soda, ,,,,,,
 shampoo, beef, sugar, mixes, pasta, toilet paper, eggs, dinner rolls, poultry, soap, laundry detergent, spaghetti sauce, laundry detergent, cereals, sandwich loaves, hand soap, ,,,
 vegetables, ice cream, fruits, ketchup, ketchup, laundry detergent, ,,,,,,,,,,,,,
 vegetables, waffles, mixes, vegetables, bagels, dishwashing liquid/detergent, sandwich loaves, all- purpose, vegetables, waffles, dinner rolls, sugar, aluminum foil, waffles, bagels, ,,,,
 vegetables, all- purpose, coffee/tea, ketchup, ketchup, hand soap, shampoo, fruits, individual meals, eggs, sandwich bags, cheeses, cereals, yogurt, laundry detergent, lunch meat, ,,,
 toilet paper, tortillas, lunch meat, eggs, beef, soda, poultry, ketchup, butter, juice, ,,,,,,,,,
 sugar, vegetables, waffles, milk, shampoo, hand soap, laundry detergent, eggs, eggs, vegetables, milk, butter, milk, poultry, tortillas, ,,,,
