 spaghetti sauce, ketchup, coffee/tea, eggs, dinner rolls, vegetables, soda, ketchup, waffles, flour, dinner rolls, eggs, cheeses, laundry detergent, soda, coffee/tea, spaghetti sauce, butter, ,
 spaghetti sauce, mixes, butter, bagels, mixes, waffles, laundry detergent, vegetables, juice, waffles, butter, vegetables, spaghetti sauce, paper towels, juice, laundry detergent, pork, pork, soap, 
 hand soap, butter, dishwashing liquid/detergent, flour, milk, poultry, vegetables, all- purpose, ,,,,,,,,,,,
 soda, vegetables, eggs, sandwich bags, fruits, vegetables, fruits, spaghetti sauce, waffles, dishwashing liquid/detergent, aluminum foil, bagels, mixes, ,,,,,,
 lunch meat, sandwich loaves, all- purpose, bagels, sandwich loaves, tortillas, poultry, laundry detergent, poultry, milk, ,,,,,,,,,
 spaghetti sauce, sugar, ketchup, cereals, pasta, cereals, soap, dinner rolls, eggs, ,,,,,,,,,,
 bagels, beef, laundry detergent, flour, ,,,,,,,,,,,,,,,
 toilet paper, pork, coffee/tea, ice cream, lunch meat, all- purpose, ice cream, hand soap, toilet paper, waffles, individual meals, vegetables, shampoo, coffee/tea, dishwashing liquid/detergent, beef, beef, dishwashing liquid/detergent, sandwich loaves, 
 soda, milk, individual meals, cereals, ,,,,,,,,,,,,,,,
 butter, juice, pork, beef, poultry, shampoo, milk, ,,,,,,,,,,,,
 sandwich loaves, vegetables, pork, sugar, individual meals, waffles, milk, yogurt, pasta, hand soap, paper towels, ketchup, beef, cheeses, soap, cereals, aluminum foil, individual meals, shampoo, all- purpose
 coffee/tea, hand soap, ketchup, all- purpose, juice, mixes, fruits, yogurt, individual meals, vegetables, coffee/tea, juice, coffee/tea, pork, sugar, ketchup, waffles, ,,
 lunch meat, dishwashing liquid/detergent, lunch meat, laundry detergent, dinner rolls, sugar, aluminum foil, tortillas, toilet paper, individual meals, aluminum foil, coffee/tea, aluminum foil, yogurt, paper towels, soap, dishwashing liquid/detergent, ketchup, ,
 poultry, vegetables, dinner rolls, bagels, soap, hand soap, soda, coffee/tea, soap, all- purpose, eggs, mixes, laundry detergent, shampoo, yogurt, sandwich loaves, vegetables, ,,
 sandwich loaves, vegetables, poultry, butter, spaghetti sauce, spaghetti sauce, all- purpose, vegetables, sugar, mixes, cheeses, pasta, vegetables, cheeses, soap, spaghetti sauce, all- purpose, pork, eggs, ice cream
 yogurt, waffles, juice, sugar, vegetables, sandwich loaves, toilet paper, individual meals, lunch meat, vegetables, yogurt, vegetables, poultry, dishwashing liquid/detergent, milk, laundry detergent, lunch meat, dishwashing liquid/detergent, pork, aluminum foil
 poultry, beef, mixes, cheeses, vegetables, lunch meat, cereals, dinner rolls, eggs, juice, beef, aluminum foil, toilet paper, sugar, butter, ,,,,
 dinner rolls, flour, paper towels, juice, sugar, coffee/tea, vegetables, vegetables, coffee/tea, flour, lunch meat, waffles, vegetables, all- purpose, yogurt, spaghetti sauce, poultry, sugar, mixes, hand soap
 sandwich loaves, waffles, sandwich loaves, pork, paper towels, bagels, tortillas, lunch meat, ice cream, dinner rolls, pork, cereals, hand soap, spaghetti sauce, beef, shampoo, vegetables, beef, juice, vegetables
 beef, soda, dinner rolls, vegetables, all- purpose, sugar, hand soap, all- purpose, beef, mixes, eggs, yogurt, mixes, dinner rolls, soap, ,,,,
 hand soap, paper towels, poultry, fruits, bagels, mixes, ,,,,,,,,,,,,,
 paper towels, tortillas, individual meals, all- purpose, soap, flour, shampoo, juice, sandwich loaves, aluminum foil, pasta, waffles, toilet paper, coffee/tea, ,,,,,
 lunch meat, vegetables, milk, eggs, paper towels, sugar, bagels, vegetables, cereals, vegetables, soap, aluminum foil, dishwashing liquid/detergent, waffles, mixes, bagels, paper towels, laundry detergent, shampoo, pork
 beef, tortillas, butter, paper towels, eggs, all- purpose, cheeses, pasta, lunch meat, paper towels, spaghetti sauce, eggs, sandwich loaves, all- purpose, toilet paper, mixes, tortillas, fruits, waffles, toilet paper
 mixes, fruits, dishwashing liquid/detergent, hand soap, cereals, lunch meat, soap, waffles, sugar, lunch meat, shampoo, dishwashing liquid/detergent, butter, flour, individual meals, juice, flour, butter, eggs, vegetables
 soda, toilet paper, individual meals, aluminum foil, coffee/tea, juice, butter, ice cream, ice cream, ,,,,,,,,,,
 individual meals, soda, spaghetti sauce, pork, vegetables, spaghetti sauce, eggs, cheeses, ,,,,,,,,,,,
 vegetables, sandwich loaves, pasta, juice, aluminum foil, shampoo, soda, hand soap, milk, vegetables, ,,,,,,,,,
 dinner rolls, fruits, eggs, shampoo, soda, bagels, paper towels, ,,,,,,,,,,,,
 sandwich loaves, sandwich loaves, hand soap, poultry, ketchup, sugar, fruits, fruits, sandwich bags, cheeses, flour, vegetables, shampoo, ,,,,,,
 ice cream, tortillas, pork, cheeses, cereals, coffee/tea, cheeses, yogurt, vegetables, vegetables, shampoo, dinner rolls, coffee/tea, waffles, vegetables, ,,,,
 ketchup, sandwich bags, waffles, toilet paper, pasta, individual meals, cheeses, shampoo, ice cream, pasta, individual meals, toilet paper, pork, poultry, fruits, pork, pork, soap, juice, ketchup
 all- purpose, cheeses, shampoo, waffles, mixes, individual meals, waffles, sandwich bags, spaghetti sauce, sandwich bags, pasta, shampoo, beef, ice cream, soap, juice, bagels, juice, vegetables, hand soap
 butter, all- purpose, laundry detergent, shampoo, coffee/tea, paper towels, soap, spaghetti sauce, cheeses, vegetables, sandwich loaves, individual meals, paper towels, dinner rolls, toilet paper, individual meals, sandwich bags, milk, cereals, poultry
 sugar, sandwich bags, poultry, yogurt, dishwashing liquid/detergent, vegetables, individual meals, vegetables, vegetables, soap, bagels, spaghetti sauce, waffles, butter, vegetables, ,,,,
 cereals, beef, sugar, coffee/tea, coffee/tea, lunch meat, pasta, soap, ,,,,,,,,,,,
 laundry detergent, mixes, poultry, individual meals, bagels, vegetables, tortillas, juice, laundry detergent, waffles, ,,,,,,,,,
 pasta, soda, vegetables, vegetables, poultry, sandwich bags, poultry, cereals, vegetables, hand soap, ,,,,,,,,,
 coffee/tea, hand soap, ice cream, beef, ,,,,,,,,,,,,,,,
 yogurt, laundry detergent, laundry detergent, dinner rolls, pasta, flour, sugar, pasta, soda, ,,,,,,,,,,
 dinner rolls, coffee/tea, sandwich loaves, ketchup, coffee/tea, beef, coffee/tea, coffee/tea, ,,,,,,,,,,,
 toilet paper, ice cream, cheeses, laundry detergent, lunch meat, soap, all- purpose, soap, ,,,,,,,,,,,
 soap, vegetables, poultry, sugar, beef, aluminum foil, cereals, milk, flour, lunch meat, ,,,,,,,,,
 bagels, ice cream, shampoo, sugar, ,,,,,,,,,,,,,,,
 pork, waffles, vegetables, dishwashing liquid/detergent, ketchup, vegetables, individual meals, ice cream, spaghetti sauce, cheeses, ketchup, fruits, hand soap, eggs, all- purpose, sandwich loaves, tortillas, ,,
 individual meals, aluminum foil, dishwashing liquid/detergent, coffee/tea, dinner rolls, coffee/tea, cheeses, ,,,,,,,,,,,,
 sandwich bags, cereals, aluminum foil, juice, soap, all- purpose, sugar, soda, juice, individual meals, beef, sugar, pork, laundry detergent, tortillas, beef, waffles, poultry, soda, beef
 dishwashing liquid/detergent, butter, bagels, fruits, shampoo, cheeses, all- purpose, coffee/tea, dinner rolls, laundry detergent, ,,,,,,,,,
 fruits, vegetables, soap, fruits, eggs, butter, mixes, spaghetti sauce, poultry, all- purpose, dishwashing liquid/detergent, beef, cheeses, vegetables, laundry detergent, sandwich bags, soda, ice cream, lunch meat, vegetables
 ice cream, paper towels, pork, mixes, vegetables, aluminum foil, spaghetti sauce, cereals, ice cream, sandwich loaves, toilet paper, toilet paper, eggs, vegetables, pasta, paper towels, ,,,
 sandwich loaves, milk, waffles, soda, vegetables, sugar, mixes, soda, milk, yogurt, toilet paper, sandwich loaves, lunch meat, individual meals, waffles, spaghetti sauce, paper towels, shampoo, ,
 tortillas, soap, shampoo, soda, yogurt, cereals, sandwich loaves, sandwich loaves, beef, poultry, all- purpose, fruits, paper towels, tortillas, vegetables, vegetables, lunch meat, ,,
 lunch meat, soap, soda, hand soap, butter, milk, lunch meat, lunch meat, ice cream, butter, lunch meat, dishwashing liquid/detergent, laundry detergent, paper towels, tortillas, coffee/tea, mixes, ,,
 cereals, individual meals, hand soap, soda, juice, pork, eggs, tortillas, tortillas, flour, ,,,,,,,,,
 lunch meat, aluminum foil, shampoo, dinner rolls, toilet paper, sugar, soda, milk, individual meals, soda, vegetables, spaghetti sauce, milk, soda, pork, soda, yogurt, shampoo, sandwich loaves, pasta
 yogurt, lunch meat, soap, individual meals, vegetables, shampoo, aluminum foil, milk, waffles, soap, paper towels, flour, shampoo, ,,,,,,
 fruits, soda, pork, yogurt, shampoo, sandwich loaves, sandwich bags, sugar, vegetables, ,,,,,,,,,,
 soda, cheeses, pasta, sandwich bags, bagels, sugar, beef, butter, all- purpose, all- purpose, sandwich loaves, juice, toilet paper, pork, butter, cheeses, tortillas, ,,
 aluminum foil, soda, spaghetti sauce, cheeses, cheeses, sandwich bags, vegetables, vegetables, cheeses, toilet paper, waffles, vegetables, all- purpose, flour, soap, ketchup, sandwich bags, waffles, ketchup, tortillas
 coffee/tea, sandwich loaves, juice, bagels, individual meals, juice, spaghetti sauce, shampoo, butter, sandwich bags, tortillas, poultry, ,,,,,,,
 aluminum foil, fruits, ice cream, sandwich loaves, tortillas, cereals, cereals, paper towels, aluminum foil, vegetables, cereals, toilet paper, cereals, milk, mixes, sugar, ,,,
 individual meals, beef, lunch meat, ice cream, individual meals, cheeses, vegetables, vegetables, coffee/tea, cereals, eggs, ,,,,,,,,
 bagels, poultry, yogurt, aluminum foil, mixes, cheeses, laundry detergent, vegetables, vegetables, pork, waffles, vegetables, sandwich bags, ketchup, shampoo, cheeses, ,,,
 ice cream, poultry, mixes, aluminum foil, pasta, laundry detergent, laundry detergent, sugar, cereals, vegetables, pork, spaghetti sauce, mixes, flour, yogurt, butter, poultry, ,,
 toilet paper, juice, sugar, shampoo, eggs, waffles, ice cream, hand soap, beef, vegetables, ,,,,,,,,,
 shampoo, laundry detergent, spaghetti sauce, mixes, sandwich loaves, aluminum foil, juice, cereals, eggs, shampoo, poultry, juice, yogurt, cereals, ,,,,,
 eggs, fruits, individual meals, tortillas, flour, ice cream, aluminum foil, ,,,,,,,,,,,,
 toilet paper, sandwich bags, bagels, waffles, cereals, mixes, dishwashing liquid/detergent, lunch meat, cheeses, sandwich loaves, tortillas, flour, soda, cheeses, mixes, toilet paper, individual meals, all- purpose, pork, 
 waffles, spaghetti sauce, poultry, vegetables, beef, vegetables, flour, coffee/tea, ketchup, vegetables, cereals, pasta, eggs, spaghetti sauce, dinner rolls, cheeses, juice, pasta, lunch meat, hand soap
 dishwashing liquid/detergent, cereals, fruits, pasta, ketchup, poultry, aluminum foil, aluminum foil, individual meals, yogurt, waffles, butter, paper towels, all- purpose, ketchup, soda, soap, soap, individual meals, soda
 dishwashing liquid/detergent, poultry, dinner rolls, bagels, fruits, shampoo, ketchup, ,,,,,,,,,,,,
 beef, shampoo, vegetables, waffles, lunch meat, ,,,,,,,,,,,,,,
 spaghetti sauce, lunch meat, dinner rolls, mixes, ,,,,,,,,,,,,,,,
 bagels, individual meals, sandwich bags, vegetables, vegetables, vegetables, ketchup, laundry detergent, soda, shampoo, flour, tortillas, yogurt, waffles, laundry detergent, laundry detergent, cereals, ,,
 ice cream, tortillas, soda, hand soap, tortillas, bagels, sandwich bags, sandwich bags, milk, sandwich bags, shampoo, ,,,,,,,,
 sugar, waffles, ketchup, fruits, butter, flour, dinner rolls, vegetables, vegetables, spaghetti sauce, aluminum foil, eggs, ,,,,,,,
 sandwich loaves, paper towels, lunch meat, sandwich loaves, flour, laundry detergent, soda, tortillas, soda, waffles, paper towels, sugar, vegetables, dinner rolls, individual meals, all- purpose, vegetables, ,,
 sugar, toilet paper, soap, lunch meat, butter, sugar, ,,,,,,,,,,,,,
 sandwich loaves, soap, soap, sandwich loaves, laundry detergent, milk, eggs, ice cream, pork, toilet paper, soda, sandwich loaves, mixes, ,,,,,,
 yogurt, soda, soap, waffles, aluminum foil, soap, pork, cereals, coffee/tea, paper towels, cheeses, eggs, flour, ,,,,,,
 sugar, milk, coffee/tea, hand soap, aluminum foil, dinner rolls, poultry, mixes, laundry detergent, butter, vegetables, ketchup, lunch meat, butter, ice cream, ,,,,
 toilet paper, toilet paper, toilet paper, lunch meat, soda, individual meals, waffles, soda, pork, dishwashing liquid/detergent, coffee/tea, ice cream, butter, eggs, ice cream, individual meals, juice, flour, juice, 
 spaghetti sauce, waffles, cheeses, pork, cereals, coffee/tea, cereals, sandwich bags, cheeses, aluminum foil, poultry, sandwich loaves, lunch meat, bagels, soap, vegetables, beef, ,,
 individual meals, lunch meat, poultry, hand soap, eggs, dinner rolls, paper towels, yogurt, toilet paper, ice cream, all- purpose, sugar, vegetables, milk, pasta, ,,,,
 hand soap, individual meals, beef, yogurt, tortillas, mixes, vegetables, cereals, toilet paper, lunch meat, aluminum foil, vegetables, yogurt, vegetables, flour, ,,,,
 tortillas, beef, cereals, ketchup, poultry, sandwich bags, poultry, all- purpose, vegetables, pasta, pasta, individual meals, paper towels, juice, pasta, poultry, ,,,
 shampoo, all- purpose, dinner rolls, coffee/tea, hand soap, aluminum foil, ,,,,,,,,,,,,,
 vegetables, soap, vegetables, ketchup, mixes, individual meals, laundry detergent, eggs, bagels, vegetables, pasta, juice, soap, mixes, ,,,,,
 butter, spaghetti sauce, pasta, ketchup, all- purpose, paper towels, individual meals, soda, soda, yogurt, spaghetti sauce, vegetables, soap, milk, dishwashing liquid/detergent, laundry detergent, spaghetti sauce, pasta, juice, milk
 soap, bagels, pork, all- purpose, paper towels, butter, milk, paper towels, mixes, eggs, cheeses, ,,,,,,,,
 sandwich bags, sandwich bags, sandwich bags, butter, sandwich loaves, ,,,,,,,,,,,,,,
 soap, pork, vegetables, butter, paper towels, sandwich bags, vegetables, vegetables, flour, cereals, all- purpose, all- purpose, toilet paper, cereals, vegetables, soda, poultry, toilet paper, lunch meat, sugar
 milk, dishwashing liquid/detergent, eggs, vegetables, yogurt, waffles, tortillas, butter, individual meals, ,,,,,,,,,,
 soda, eggs, bagels, eggs, dinner rolls, laundry detergent, soda, paper towels, toilet paper, soap, dinner rolls, pasta, vegetables, ,,,,,,
 sandwich bags, sugar, cheeses, milk, ketchup, flour, sandwich loaves, vegetables, soda, spaghetti sauce, ,,,,,,,,,
 flour, pork, spaghetti sauce, coffee/tea, cheeses, ketchup, cheeses, tortillas, aluminum foil, milk, dinner rolls, bagels, individual meals, ,,,,,,
 hand soap, coffee/tea, paper towels, soda, cheeses, soap, waffles, soda, milk, yogurt, pork, coffee/tea, cheeses, poultry, waffles, fruits, soap, pasta, ice cream, juice
 vegetables, beef, pasta, eggs, sandwich loaves, cheeses, poultry, cheeses, waffles, fruits, soap, hand soap, beef, poultry, ice cream, sandwich loaves, aluminum foil, sandwich loaves, yogurt, toilet paper
 poultry, spaghetti sauce, individual meals, pork, sugar, tortillas, soap, ketchup, poultry, juice, fruits, paper towels, soda, yogurt, sandwich bags, mixes, pork, bagels, poultry, 
 ice cream, bagels, sugar, sugar, laundry detergent, butter, individual meals, cereals, tortillas, cereals, laundry detergent, all- purpose, vegetables, tortillas, dishwashing liquid/detergent, cheeses, waffles, pasta, coffee/tea, vegetables
 eggs, cereals, vegetables, pork, individual meals, all- purpose, juice, all- purpose, all- purpose, aluminum foil, spaghetti sauce, paper towels, sandwich bags, yogurt, sandwich loaves, paper towels, shampoo, coffee/tea, ,
 sandwich loaves, yogurt, butter, flour, tortillas, all- purpose, beef, pasta, ketchup, sugar, individual meals, aluminum foil, lunch meat, soap, ,,,,,
 milk, lunch meat, butter, laundry detergent, spaghetti sauce, cheeses, soap, ice cream, ,,,,,,,,,,,
 aluminum foil, soda, hand soap, toilet paper, dishwashing liquid/detergent, milk, hand soap, ice cream, soap, pork, mixes, all- purpose, ,,,,,,,
 shampoo, flour, milk, aluminum foil, ketchup, pasta, laundry detergent, mixes, individual meals, pork, aluminum foil, ,,,,,,,,
 flour, coffee/tea, shampoo, lunch meat, bagels, tortillas, hand soap, beef, aluminum foil, all- purpose, soap, waffles, ,,,,,,,
 pork, ice cream, all- purpose, toilet paper, bagels, eggs, individual meals, aluminum foil, vegetables, sandwich loaves, ketchup, lunch meat, laundry detergent, fruits, ,,,,,
 cheeses, fruits, mixes, flour, aluminum foil, soap, eggs, dishwashing liquid/detergent, juice, milk, coffee/tea, hand soap, ,,,,,,,
 sandwich bags, bagels, eggs, shampoo, pasta, sugar, dinner rolls, lunch meat, sandwich loaves, vegetables, hand soap, lunch meat, all- purpose, sandwich bags, laundry detergent, vegetables, toilet paper, fruits, lunch meat, waffles
 ketchup, individual meals, milk, coffee/tea, eggs, ,,,,,,,,,,,,,,
 hand soap, laundry detergent, sugar, soap, individual meals, flour, lunch meat, butter, sandwich bags, all- purpose, hand soap, sugar, sandwich loaves, aluminum foil, poultry, aluminum foil, hand soap, shampoo, ,
 poultry, pasta, vegetables, cereals, eggs, sugar, sugar, pork, ,,,,,,,,,,,
 beef, aluminum foil, eggs, milk, dinner rolls, ,,,,,,,,,,,,,,
 pork, sandwich loaves, butter, tortillas, spaghetti sauce, dinner rolls, lunch meat, coffee/tea, dinner rolls, coffee/tea, vegetables, soap, flour, coffee/tea, mixes, dishwashing liquid/detergent, sandwich bags, cheeses, aluminum foil, 
 pork, hand soap, sugar, waffles, sandwich bags, all- purpose, all- purpose, pasta, dinner rolls, bagels, mixes, sandwich bags, beef, tortillas, mixes, ,,,,
 fruits, coffee/tea, pasta, sandwich loaves, juice, ice cream, vegetables, yogurt, cereals, cheeses, hand soap, yogurt, tortillas, soap, vegetables, ,,,,
 pork, soap, soda, paper towels, butter, dishwashing liquid/detergent, dinner rolls, lunch meat, ,,,,,,,,,,,
 yogurt, bagels, yogurt, cheeses, spaghetti sauce, yogurt, ,,,,,,,,,,,,,
 cheeses, soap, vegetables, waffles, cheeses, lunch meat, soap, all- purpose, soap, sugar, ice cream, cereals, hand soap, pork, juice, tortillas, lunch meat, sandwich loaves, butter, 
 ice cream, all- purpose, hand soap, all- purpose, dishwashing liquid/detergent, paper towels, ketchup, ,,,,,,,,,,,,
 ice cream, sandwich bags, individual meals, juice, fruits, cereals, pasta, ,,,,,,,,,,,,
 milk, vegetables, coffee/tea, mixes, sandwich loaves, sandwich bags, waffles, ,,,,,,,,,,,,
 mixes, coffee/tea, paper towels, dishwashing liquid/detergent, mixes, ,,,,,,,,,,,,,,
 paper towels, sandwich loaves, yogurt, flour, lunch meat, sugar, laundry detergent, pork, ,,,,,,,,,,,
 sandwich loaves, aluminum foil, lunch meat, toilet paper, waffles, pasta, waffles, hand soap, tortillas, pork, butter, hand soap, laundry detergent, milk, sandwich loaves, paper towels, mixes, vegetables, soda, yogurt
 vegetables, cereals, dishwashing liquid/detergent, cereals, vegetables, sugar, cereals, ,,,,,,,,,,,,
 laundry detergent, poultry, spaghetti sauce, vegetables, mixes, coffee/tea, ,,,,,,,,,,,,,
 laundry detergent, cheeses, shampoo, laundry detergent, hand soap, fruits, fruits, fruits, dinner rolls, soap, pork, cheeses, vegetables, sandwich bags, ,,,,,
 dishwashing liquid/detergent, bagels, laundry detergent, dinner rolls, cheeses, juice, sandwich bags, dinner rolls, fruits, yogurt, paper towels, lunch meat, aluminum foil, paper towels, aluminum foil, ,,,,
 aluminum foil, butter, pork, coffee/tea, vegetables, juice, eggs, sandwich loaves, ,,,,,,,,,,,
 aluminum foil, shampoo, ketchup, tortillas, ,,,,,,,,,,,,,,,
 tortillas, milk, flour, vegetables, paper towels, cereals, ,,,,,,,,,,,,,
 coffee/tea, vegetables, sandwich loaves, tortillas, tortillas, sandwich bags, soda, vegetables, waffles, ice cream, milk, beef, mixes, toilet paper, soda, ,,,,
 sugar, cheeses, beef, spaghetti sauce, lunch meat, soap, vegetables, paper towels, aluminum foil, toilet paper, dinner rolls, eggs, pasta, hand soap, spaghetti sauce, cereals, aluminum foil, vegetables, milk, spaghetti sauce
 toilet paper, soap, soda, cereals, vegetables, shampoo, yogurt, sugar, cereals, poultry, lunch meat, waffles, ice cream, sandwich loaves, soda, yogurt, tortillas, ,,
 flour, flour, individual meals, hand soap, dishwashing liquid/detergent, aluminum foil, cheeses, vegetables, ,,,,,,,,,,,
 laundry detergent, ketchup, ketchup, sugar, soap, lunch meat, vegetables, pork, lunch meat, ,,,,,,,,,,
 yogurt, mixes, ketchup, eggs, ,,,,,,,,,,,,,,,
 cheeses, individual meals, pork, butter, eggs, fruits, laundry detergent, dishwashing liquid/detergent, soda, mixes, pasta, toilet paper, spaghetti sauce, dinner rolls, lunch meat, ,,,,
 sandwich bags, bagels, spaghetti sauce, hand soap, laundry detergent, sugar, spaghetti sauce, dishwashing liquid/detergent, poultry, individual meals, yogurt, ,,,,,,,,
 paper towels, butter, coffee/tea, sandwich bags, ,,,,,,,,,,,,,,,
 tortillas, hand soap, ice cream, bagels, cereals, shampoo, vegetables, sandwich loaves, eggs, individual meals, paper towels, soap, butter, ketchup, ,,,,,
 bagels, poultry, ice cream, aluminum foil, spaghetti sauce, vegetables, pasta, pasta, paper towels, poultry, all- purpose, hand soap, fruits, soda, ,,,,,
 juice, pork, sandwich bags, aluminum foil, toilet paper, dinner rolls, ketchup, milk, flour, fruits, hand soap, ice cream, coffee/tea, mixes, vegetables, waffles, vegetables, soda, flour, toilet paper
 toilet paper, hand soap, coffee/tea, fruits, flour, laundry detergent, bagels, ,,,,,,,,,,,,
 bagels, fruits, laundry detergent, toilet paper, ,,,,,,,,,,,,,,,
 poultry, shampoo, hand soap, cereals, butter, dinner rolls, cereals, tortillas, yogurt, dishwashing liquid/detergent, vegetables, soda, fruits, soda, eggs, mixes, pasta, soap, ,
 butter, vegetables, aluminum foil, individual meals, poultry, hand soap, sugar, soda, soda, vegetables, laundry detergent, vegetables, flour, eggs, waffles, soda, sandwich loaves, sandwich loaves, beef, 
 pasta, ice cream, pork, dishwashing liquid/detergent, ice cream, paper towels, ice cream, lunch meat, paper towels, waffles, tortillas, milk, butter, vegetables, bagels, tortillas, eggs, aluminum foil, all- purpose, 
 tortillas, aluminum foil, yogurt, individual meals, lunch meat, waffles, toilet paper, poultry, sandwich loaves, aluminum foil, milk, dinner rolls, individual meals, flour, fruits, waffles, sugar, butter, pork, 
 vegetables, vegetables, paper towels, lunch meat, waffles, paper towels, butter, vegetables, butter, tortillas, ice cream, spaghetti sauce, waffles, ,,,,,,
 waffles, hand soap, fruits, sugar, milk, bagels, dishwashing liquid/detergent, waffles, soda, ice cream, pasta, flour, butter, mixes, tortillas, ,,,,
 dishwashing liquid/detergent, aluminum foil, sandwich bags, poultry, flour, waffles, ,,,,,,,,,,,,,
 sandwich loaves, paper towels, sugar, mixes, ,,,,,,,,,,,,,,,
 vegetables, eggs, eggs, waffles, ,,,,,,,,,,,,,,,
 waffles, waffles, toilet paper, tortillas, fruits, hand soap, all- purpose, flour, all- purpose, tortillas, mixes, soda, mixes, shampoo, sandwich loaves, spaghetti sauce, mixes, coffee/tea, dinner rolls, beef
 dinner rolls, juice, aluminum foil, paper towels, hand soap, ice cream, vegetables, vegetables, aluminum foil, tortillas, soda, bagels, vegetables, vegetables, pasta, cheeses, butter, ,,
 beef, yogurt, butter, yogurt, waffles, waffles, ,,,,,,,,,,,,,
 vegetables, cereals, ketchup, bagels, ice cream, ,,,,,,,,,,,,,,
 butter, butter, aluminum foil, aluminum foil, sandwich loaves, toilet paper, poultry, aluminum foil, vegetables, pasta, butter, coffee/tea, pasta, yogurt, milk, beef, toilet paper, ,,
 vegetables, eggs, vegetables, laundry detergent, cereals, all- purpose, ,,,,,,,,,,,,,
 poultry, waffles, tortillas, aluminum foil, flour, beef, yogurt, waffles, all- purpose, vegetables, flour, tortillas, butter, individual meals, ,,,,,
 ice cream, bagels, waffles, ice cream, dishwashing liquid/detergent, sandwich bags, sugar, cheeses, spaghetti sauce, flour, pasta, pasta, eggs, paper towels, vegetables, pasta, beef, ice cream, pork, waffles
 poultry, bagels, coffee/tea, all- purpose, sandwich loaves, spaghetti sauce, shampoo, mixes, sandwich loaves, soda, individual meals, dishwashing liquid/detergent, dinner rolls, laundry detergent, bagels, individual meals, vegetables, pasta, bagels, sugar
 sandwich loaves, sugar, fruits, eggs, cheeses, spaghetti sauce, waffles, ,,,,,,,,,,,,
 dinner rolls, cheeses, laundry detergent, all- purpose, pasta, aluminum foil, fruits, ketchup, fruits, butter, ice cream, paper towels, fruits, sugar, vegetables, ,,,,
 cereals, cheeses, paper towels, tortillas, flour, sandwich loaves, all- purpose, ,,,,,,,,,,,,
 cereals, shampoo, dishwashing liquid/detergent, individual meals, fruits, poultry, beef, vegetables, yogurt, waffles, toilet paper, juice, individual meals, vegetables, eggs, soda, bagels, paper towels, fruits, yogurt
 lunch meat, butter, cereals, fruits, fruits, tortillas, waffles, hand soap, ,,,,,,,,,,,
 flour, beef, coffee/tea, sandwich bags, poultry, poultry, eggs, yogurt, mixes, yogurt, all- purpose, flour, spaghetti sauce, individual meals, vegetables, yogurt, beef, sandwich loaves, ice cream, sugar
 eggs, shampoo, aluminum foil, milk, waffles, ketchup, ,,,,,,,,,,,,,
 fruits, dishwashing liquid/detergent, paper towels, pasta, waffles, ,,,,,,,,,,,,,,
 laundry detergent, vegetables, soap, shampoo, milk, eggs, paper towels, ,,,,,,,,,,,,
 toilet paper, lunch meat, aluminum foil, lunch meat, laundry detergent, toilet paper, vegetables, vegetables, all- purpose, bagels, pasta, ,,,,,,,,
 vegetables, juice, sandwich bags, shampoo, poultry, beef, lunch meat, coffee/tea, sandwich loaves, ,,,,,,,,,,
