 vegetables, ice cream, flour, sandwich loaves, cereals, ketchup, sugar, pasta, cheeses, pasta, mixes, laundry detergent, sandwich loaves, eggs, ,,,,,
 poultry, vegetables, all- purpose, bagels, beef, ice cream, sandwich bags, yogurt, vegetables, juice, sandwich bags, ,,,,,,,,
 poultry, eggs, yogurt, sugar, juice, aluminum foil, vegetables, poultry, vegetables, waffles, mixes, vegetables, bagels, cheeses, ketchup, individual meals, vegetables, all- purpose, ,
 soap, lunch meat, vegetables, laundry detergent, milk, bagels, lunch meat, tortillas, pork, eggs, soda, sandwich bags, paper towels, tortillas, mixes, eggs, waffles, waffles, hand soap, 
 pork, yogurt, ice cream, lunch meat, vegetables, milk, cereals, spaghetti sauce, yogurt, toilet paper, all- purpose, sandwich bags, flour, poultry, poultry, ,,,,
 soda, ice cream, waffles, shampoo, lunch meat, fruits, pork, aluminum foil, pasta, pasta, coffee/tea, toilet paper, spaghetti sauce, beef, vegetables, pork, pasta, dishwashing liquid/detergent, ,
 soap, cereals, vegetables, coffee/tea, ice cream, beef, individual meals, poultry, dinner rolls, lunch meat, beef, pork, ,,,,,,,
 juice, hand soap, all- purpose, pasta, sandwich loaves, vegetables, soap, ,,,,,,,,,,,,
 yogurt, all- purpose, dishwashing liquid/detergent, vegetables, aluminum foil, vegetables, dinner rolls, poultry, tortillas, laundry detergent, fruits, individual meals, vegetables, pork, beef, lunch meat, ,,,
 all- purpose, laundry detergent, sandwich loaves, sugar, vegetables, spaghetti sauce, soda, beef, dishwashing liquid/detergent, vegetables, milk, flour, poultry, cereals, flour, vegetables, vegetables, lunch meat, cereals, lunch meat
 ketchup, yogurt, laundry detergent, lunch meat, pork, mixes, ketchup, shampoo, mixes, aluminum foil, pasta, mixes, soap, vegetables, bagels, hand soap, fruits, vegetables, poultry, pork
 beef, all- purpose, sugar, dishwashing liquid/detergent, butter, milk, ,,,,,,,,,,,,,
 bagels, paper towels, pork, shampoo, butter, ,,,,,,,,,,,,,,
 individual meals, bagels, dinner rolls, all- purpose, paper towels, soap, sandwich loaves, cheeses, individual meals, laundry detergent, ketchup, pasta, lunch meat, juice, paper towels, pasta, poultry, hand soap, waffles, ketchup
 all- purpose, ice cream, coffee/tea, all- purpose, toilet paper, individual meals, flour, juice, toilet paper, soap, pasta, paper towels, cheeses, lunch meat, sugar, ,,,,
 beef, cereals, paper towels, waffles, sandwich loaves, vegetables, coffee/tea, all- purpose, ,,,,,,,,,,,
 shampoo, paper towels, pasta, fruits, soda, paper towels, yogurt, butter, individual meals, individual meals, cereals, vegetables, sugar, paper towels, flour, butter, shampoo, poultry, vegetables, juice
 aluminum foil, ice cream, flour, aluminum foil, mixes, vegetables, ketchup, yogurt, fruits, ice cream, vegetables, sugar, beef, soap, pasta, toilet paper, aluminum foil, vegetables, paper towels, 
 soap, coffee/tea, vegetables, coffee/tea, yogurt, vegetables, juice, pork, individual meals, vegetables, pork, cheeses, vegetables, bagels, pasta, pork, pasta, eggs, all- purpose, 
 flour, hand soap, cheeses, soap, sandwich bags, all- purpose, mixes, ketchup, fruits, ,,,,,,,,,,
 beef, soap, fruits, cereals, paper towels, ketchup, eggs, pasta, poultry, cheeses, poultry, fruits, tortillas, sandwich loaves, individual meals, tortillas, mixes, ,,
 sandwich bags, cheeses, juice, laundry detergent, individual meals, lunch meat, waffles, vegetables, yogurt, waffles, ,,,,,,,,,
 toilet paper, dinner rolls, juice, vegetables, eggs, poultry, dishwashing liquid/detergent, sandwich loaves, all- purpose, waffles, sandwich loaves, soda, toilet paper, shampoo, ,,,,,
 dinner rolls, vegetables, milk, ice cream, vegetables, ice cream, ,,,,,,,,,,,,,
 milk, eggs, poultry, poultry, hand soap, bagels, all- purpose, coffee/tea, soap, aluminum foil, coffee/tea, lunch meat, all- purpose, yogurt, juice, toilet paper, fruits, ,,
 all- purpose, ice cream, tortillas, milk, coffee/tea, fruits, cereals, dinner rolls, pork, spaghetti sauce, sugar, shampoo, spaghetti sauce, cereals, cheeses, ,,,,
 pork, ketchup, flour, pork, eggs, ,,,,,,,,,,,,,,
 butter, pork, pork, hand soap, tortillas, milk, tortillas, ,,,,,,,,,,,,
 eggs, cheeses, butter, sandwich bags, vegetables, dinner rolls, sandwich bags, waffles, waffles, waffles, ,,,,,,,,,
 yogurt, sandwich bags, individual meals, fruits, pasta, ice cream, soap, ,,,,,,,,,,,,
 yogurt, vegetables, poultry, waffles, poultry, vegetables, waffles, spaghetti sauce, beef, sugar, lunch meat, hand soap, dinner rolls, hand soap, hand soap, ,,,,
 coffee/tea, all- purpose, beef, hand soap, paper towels, bagels, lunch meat, spaghetti sauce, poultry, vegetables, tortillas, individual meals, juice, poultry, butter, sugar, fruits, ,,
 tortillas, coffee/tea, beef, ketchup, ,,,,,,,,,,,,,,,
 cheeses, pasta, milk, ice cream, toilet paper, ,,,,,,,,,,,,,,
 poultry, soda, milk, milk, spaghetti sauce, laundry detergent, fruits, cereals, pasta, vegetables, pasta, ketchup, tortillas, ,,,,,,
 shampoo, toilet paper, all- purpose, vegetables, cereals, ,,,,,,,,,,,,,,
 pasta, sandwich bags, individual meals, waffles, ,,,,,,,,,,,,,,,
 dishwashing liquid/detergent, individual meals, individual meals, soap, sandwich loaves, spaghetti sauce, pasta, pork, poultry, shampoo, spaghetti sauce, lunch meat, coffee/tea, sandwich loaves, hand soap, shampoo, tortillas, ketchup, poultry, 
 butter, toilet paper, laundry detergent, sugar, sandwich bags, pasta, beef, spaghetti sauce, vegetables, ice cream, ketchup, cheeses, vegetables, fruits, cereals, ketchup, hand soap, mixes, sandwich bags, 
 cheeses, soap, aluminum foil, mixes, pork, soap, pasta, ,,,,,,,,,,,,
 all- purpose, aluminum foil, paper towels, vegetables, shampoo, sandwich loaves, lunch meat, sandwich bags, sandwich loaves, eggs, hand soap, shampoo, milk, bagels, cheeses, ,,,,
 bagels, vegetables, waffles, dinner rolls, mixes, coffee/tea, coffee/tea, individual meals, yogurt, dishwashing liquid/detergent, waffles, waffles, pasta, eggs, dinner rolls, yogurt, ,,,
 shampoo, juice, paper towels, pork, dinner rolls, pasta, milk, pasta, toilet paper, butter, tortillas, coffee/tea, pasta, sugar, vegetables, yogurt, coffee/tea, sandwich bags, ,
 shampoo, cereals, pork, butter, dinner rolls, sandwich bags, milk, shampoo, soda, hand soap, flour, milk, beef, pork, sugar, toilet paper, paper towels, waffles, ketchup, 
 coffee/tea, ice cream, lunch meat, aluminum foil, juice, soap, all- purpose, sandwich loaves, coffee/tea, sandwich bags, yogurt, sandwich loaves, pork, pork, soda, soda, ,,,
 cheeses, paper towels, fruits, yogurt, juice, all- purpose, laundry detergent, toilet paper, yogurt, vegetables, fruits, spaghetti sauce, ,,,,,,,
 shampoo, cheeses, sugar, ketchup, ,,,,,,,,,,,,,,,
 poultry, sugar, ice cream, vegetables, vegetables, juice, paper towels, lunch meat, vegetables, ,,,,,,,,,,
 yogurt, aluminum foil, soda, paper towels, beef, laundry detergent, vegetables, ice cream, eggs, fruits, laundry detergent, poultry, ,,,,,,,
 poultry, milk, laundry detergent, toilet paper, vegetables, cheeses, dishwashing liquid/detergent, pasta, cereals, paper towels, individual meals, laundry detergent, toilet paper, eggs, sugar, paper towels, coffee/tea, ,,
 spaghetti sauce, hand soap, spaghetti sauce, beef, shampoo, sandwich bags, ,,,,,,,,,,,,,
 waffles, yogurt, sugar, toilet paper, vegetables, juice, sandwich loaves, waffles, cereals, mixes, butter, sandwich loaves, milk, laundry detergent, milk, ,,,,
 aluminum foil, ice cream, mixes, ketchup, soda, lunch meat, ketchup, soap, beef, dishwashing liquid/detergent, ice cream, ice cream, bagels, yogurt, poultry, mixes, juice, coffee/tea, fruits, 
 shampoo, individual meals, vegetables, bagels, pork, spaghetti sauce, fruits, dishwashing liquid/detergent, pasta, ,,,,,,,,,,
 flour, flour, ketchup, cheeses, hand soap, mixes, hand soap, pork, pasta, ,,,,,,,,,,
 coffee/tea, vegetables, juice, aluminum foil, spaghetti sauce, fruits, shampoo, lunch meat, mixes, pork, aluminum foil, vegetables, individual meals, paper towels, soap, ,,,,
 paper towels, bagels, butter, toilet paper, soap, sandwich bags, juice, ice cream, vegetables, sandwich loaves, toilet paper, fruits, pork, waffles, ice cream, coffee/tea, laundry detergent, ice cream, yogurt, sugar
 dinner rolls, individual meals, sandwich loaves, bagels, juice, ,,,,,,,,,,,,,,
 dinner rolls, fruits, yogurt, fruits, cereals, all- purpose, coffee/tea, shampoo, shampoo, beef, vegetables, coffee/tea, poultry, flour, ,,,,,
 milk, mixes, soap, soda, spaghetti sauce, sandwich bags, ,,,,,,,,,,,,,
 laundry detergent, beef, sandwich bags, soap, milk, paper towels, sugar, shampoo, vegetables, ice cream, aluminum foil, vegetables, sandwich loaves, ,,,,,,
 shampoo, cheeses, cheeses, paper towels, mixes, spaghetti sauce, lunch meat, individual meals, tortillas, toilet paper, beef, pork, cheeses, sandwich bags, sugar, shampoo, fruits, hand soap, tortillas, 
 butter, bagels, mixes, mixes, hand soap, sandwich bags, spaghetti sauce, sugar, cheeses, bagels, hand soap, mixes, bagels, sandwich loaves, laundry detergent, toilet paper, waffles, ketchup, milk, vegetables
 aluminum foil, pork, sugar, vegetables, all- purpose, individual meals, beef, sandwich bags, lunch meat, waffles, pasta, beef, laundry detergent, paper towels, soap, poultry, ,,,
 juice, ice cream, lunch meat, toilet paper, shampoo, ketchup, lunch meat, vegetables, poultry, yogurt, sandwich loaves, pork, spaghetti sauce, ketchup, lunch meat, vegetables, shampoo, beef, ,
 butter, cheeses, aluminum foil, yogurt, shampoo, hand soap, hand soap, aluminum foil, sugar, waffles, pasta, vegetables, bagels, aluminum foil, fruits, soap, pork, dishwashing liquid/detergent, sandwich bags, 
 paper towels, milk, cheeses, eggs, dinner rolls, sandwich loaves, toilet paper, soap, milk, lunch meat, dinner rolls, shampoo, juice, ice cream, soap, vegetables, butter, ,,
 laundry detergent, pasta, poultry, laundry detergent, shampoo, toilet paper, yogurt, waffles, spaghetti sauce, eggs, lunch meat, sandwich loaves, coffee/tea, beef, soda, flour, ice cream, spaghetti sauce, sandwich loaves, mixes
 coffee/tea, aluminum foil, mixes, vegetables, dinner rolls, waffles, ,,,,,,,,,,,,,
 aluminum foil, coffee/tea, sandwich loaves, sandwich loaves, shampoo, shampoo, laundry detergent, pork, dishwashing liquid/detergent, milk, pasta, coffee/tea, juice, poultry, toilet paper, all- purpose, dishwashing liquid/detergent, cereals, ,
 flour, dinner rolls, tortillas, hand soap, soda, laundry detergent, lunch meat, soap, bagels, tortillas, yogurt, tortillas, pasta, fruits, tortillas, ice cream, shampoo, ice cream, ,
 dishwashing liquid/detergent, vegetables, sugar, butter, fruits, sugar, juice, waffles, toilet paper, pasta, ,,,,,,,,,
 vegetables, poultry, juice, laundry detergent, vegetables, paper towels, ,,,,,,,,,,,,,
 ice cream, eggs, cereals, lunch meat, pasta, butter, poultry, poultry, yogurt, ,,,,,,,,,,
 flour, fruits, soap, individual meals, hand soap, mixes, pasta, pork, all- purpose, vegetables, toilet paper, ,,,,,,,,
 soda, pork, ice cream, shampoo, bagels, poultry, ,,,,,,,,,,,,,
 eggs, individual meals, paper towels, toilet paper, ,,,,,,,,,,,,,,,
 flour, sugar, soap, soap, soda, bagels, fruits, vegetables, vegetables, all- purpose, bagels, soda, hand soap, mixes, vegetables, ,,,,
 beef, vegetables, individual meals, beef, spaghetti sauce, butter, dishwashing liquid/detergent, pasta, vegetables, coffee/tea, ,,,,,,,,,
 poultry, mixes, yogurt, lunch meat, tortillas, yogurt, pasta, pasta, toilet paper, tortillas, butter, poultry, pork, dishwashing liquid/detergent, yogurt, beef, waffles, juice, dishwashing liquid/detergent, dinner rolls
 all- purpose, laundry detergent, yogurt, dishwashing liquid/detergent, individual meals, laundry detergent, ,,,,,,,,,,,,,
 milk, pork, waffles, paper towels, dinner rolls, ,,,,,,,,,,,,,,
 vegetables, soda, hand soap, butter, ,,,,,,,,,,,,,,,
 pork, bagels, aluminum foil, soap, flour, sandwich bags, paper towels, cereals, ice cream, juice, spaghetti sauce, paper towels, cheeses, coffee/tea, aluminum foil, pasta, cereals, dishwashing liquid/detergent, lunch meat, pork
 hand soap, soda, vegetables, eggs, butter, pork, juice, sugar, aluminum foil, juice, all- purpose, sandwich loaves, pork, eggs, cereals, laundry detergent, ,,,
 all- purpose, dinner rolls, aluminum foil, dinner rolls, tortillas, tortillas, fruits, spaghetti sauce, coffee/tea, fruits, lunch meat, pasta, ketchup, ,,,,,,
 individual meals, poultry, eggs, juice, ketchup, coffee/tea, vegetables, vegetables, dishwashing liquid/detergent, tortillas, all- purpose, sugar, vegetables, toilet paper, lunch meat, ,,,,
 vegetables, bagels, paper towels, mixes, ice cream, milk, toilet paper, paper towels, soap, yogurt, dishwashing liquid/detergent, shampoo, beef, sandwich loaves, beef, sandwich bags, flour, mixes, paper towels, eggs
 sandwich loaves, vegetables, pasta, butter, sandwich loaves, toilet paper, individual meals, all- purpose, dishwashing liquid/detergent, individual meals, individual meals, dishwashing liquid/detergent, cheeses, individual meals, ,,,,,
 soda, sugar, aluminum foil, waffles, individual meals, individual meals, toilet paper, sandwich bags, tortillas, waffles, lunch meat, toilet paper, sandwich bags, dishwashing liquid/detergent, ,,,,,
 cereals, vegetables, sandwich loaves, paper towels, pasta, pork, shampoo, dishwashing liquid/detergent, bagels, soap, bagels, milk, waffles, individual meals, bagels, mixes, waffles, lunch meat, sandwich bags, 
 vegetables, laundry detergent, dishwashing liquid/detergent, lunch meat, flour, individual meals, ,,,,,,,,,,,,,
 flour, fruits, vegetables, spaghetti sauce, soda, spaghetti sauce, aluminum foil, yogurt, soda, soda, spaghetti sauce, pork, waffles, ketchup, dishwashing liquid/detergent, ,,,,
 dishwashing liquid/detergent, cheeses, cheeses, cereals, aluminum foil, ketchup, poultry, mixes, yogurt, paper towels, vegetables, ice cream, aluminum foil, flour, ketchup, sandwich bags, flour, waffles, juice, yogurt
 spaghetti sauce, toilet paper, sandwich bags, aluminum foil, sugar, cheeses, poultry, yogurt, poultry, poultry, cheeses, juice, soap, aluminum foil, bagels, hand soap, dishwashing liquid/detergent, milk, flour, yogurt
 sandwich bags, soda, yogurt, cheeses, aluminum foil, pork, milk, ice cream, beef, vegetables, cereals, vegetables, ,,,,,,,
 cereals, tortillas, ice cream, hand soap, waffles, ketchup, laundry detergent, coffee/tea, ,,,,,,,,,,,
 soda, pasta, soda, flour, soda, ,,,,,,,,,,,,,,
 ketchup, ice cream, flour, vegetables, yogurt, waffles, sandwich bags, ,,,,,,,,,,,,
 sugar, hand soap, lunch meat, spaghetti sauce, dishwashing liquid/detergent, yogurt, bagels, fruits, lunch meat, lunch meat, eggs, cereals, toilet paper, flour, ,,,,,
 pork, bagels, hand soap, eggs, mixes, vegetables, tortillas, coffee/tea, bagels, lunch meat, toilet paper, bagels, pasta, sandwich bags, milk, milk, lunch meat, ,,
 sandwich bags, juice, juice, milk, vegetables, yogurt, butter, ice cream, all- purpose, butter, yogurt, mixes, aluminum foil, hand soap, coffee/tea, yogurt, poultry, juice, milk, 
 tortillas, hand soap, paper towels, dishwashing liquid/detergent, soda, pasta, cheeses, individual meals, aluminum foil, pork, sugar, butter, ice cream, waffles, butter, vegetables, ,,,
 pork, yogurt, juice, pork, sugar, ,,,,,,,,,,,,,,
 shampoo, dinner rolls, flour, vegetables, laundry detergent, paper towels, ice cream, paper towels, dishwashing liquid/detergent, sandwich loaves, laundry detergent, ,,,,,,,,
 sandwich bags, pasta, coffee/tea, mixes, butter, spaghetti sauce, aluminum foil, soda, sandwich loaves, beef, dinner rolls, bagels, fruits, butter, ,,,,,
 juice, sandwich loaves, milk, shampoo, sandwich loaves, coffee/tea, eggs, ,,,,,,,,,,,,
 toilet paper, hand soap, mixes, paper towels, mixes, cheeses, tortillas, spaghetti sauce, lunch meat, individual meals, cereals, tortillas, all- purpose, paper towels, ,,,,,
 paper towels, pork, butter, vegetables, vegetables, tortillas, ketchup, lunch meat, vegetables, vegetables, lunch meat, sugar, mixes, pasta, soap, ,,,,
 soap, yogurt, juice, mixes, sandwich bags, bagels, shampoo, sandwich loaves, butter, vegetables, shampoo, beef, ketchup, dinner rolls, cheeses, sugar, dishwashing liquid/detergent, ketchup, ,
 waffles, juice, toilet paper, flour, pasta, fruits, cheeses, eggs, butter, juice, flour, hand soap, sandwich loaves, ,,,,,,
 tortillas, sugar, flour, spaghetti sauce, soda, ice cream, paper towels, ,,,,,,,,,,,,
 vegetables, mixes, spaghetti sauce, lunch meat, tortillas, soap, poultry, mixes, paper towels, milk, pork, mixes, juice, ,,,,,,
 cheeses, toilet paper, soap, fruits, pasta, soda, fruits, spaghetti sauce, mixes, waffles, juice, soda, ,,,,,,,
 butter, vegetables, sugar, aluminum foil, vegetables, butter, sugar, bagels, yogurt, vegetables, soap, paper towels, bagels, all- purpose, cereals, coffee/tea, vegetables, sugar, bagels, eggs
 ketchup, bagels, waffles, individual meals, butter, dinner rolls, flour, toilet paper, dinner rolls, paper towels, paper towels, mixes, coffee/tea, ,,,,,,
 laundry detergent, lunch meat, paper towels, sandwich loaves, juice, soap, ,,,,,,,,,,,,,
 spaghetti sauce, cereals, bagels, dinner rolls, ketchup, waffles, mixes, shampoo, dishwashing liquid/detergent, fruits, tortillas, vegetables, aluminum foil, spaghetti sauce, coffee/tea, ,,,,
 fruits, coffee/tea, soap, sugar, dishwashing liquid/detergent, poultry, pasta, cereals, individual meals, hand soap, ,,,,,,,,,
 tortillas, aluminum foil, milk, waffles, sandwich loaves, laundry detergent, dishwashing liquid/detergent, ,,,,,,,,,,,,
 soap, sandwich bags, laundry detergent, eggs, shampoo, laundry detergent, toilet paper, spaghetti sauce, ketchup, sandwich bags, cereals, milk, butter, ketchup, soap, pasta, hand soap, ,,
 spaghetti sauce, pasta, laundry detergent, shampoo, cheeses, butter, dinner rolls, pork, eggs, poultry, shampoo, toilet paper, spaghetti sauce, sugar, ketchup, hand soap, flour, waffles, juice, 
 tortillas, laundry detergent, flour, ketchup, butter, vegetables, mixes, fruits, lunch meat, vegetables, sandwich loaves, pork, cheeses, milk, pork, all- purpose, bagels, poultry, paper towels, tortillas
 coffee/tea, ketchup, shampoo, waffles, sandwich bags, dishwashing liquid/detergent, individual meals, pork, toilet paper, ice cream, ketchup, lunch meat, pasta, soap, juice, all- purpose, paper towels, ,,
 aluminum foil, sandwich bags, fruits, cereals, dinner rolls, sandwich bags, sandwich loaves, ,,,,,,,,,,,,
 dishwashing liquid/detergent, ice cream, coffee/tea, vegetables, sugar, cheeses, tortillas, hand soap, poultry, sugar, soap, tortillas, ice cream, ,,,,,,
 bagels, waffles, milk, bagels, beef, vegetables, laundry detergent, paper towels, milk, vegetables, lunch meat, shampoo, toilet paper, all- purpose, fruits, ,,,,
 vegetables, poultry, juice, sugar, dinner rolls, soda, waffles, dishwashing liquid/detergent, milk, fruits, mixes, lunch meat, individual meals, soda, laundry detergent, sugar, vegetables, lunch meat, soap, sandwich bags
 ice cream, cheeses, milk, yogurt, vegetables, shampoo, butter, juice, ice cream, lunch meat, paper towels, cheeses, individual meals, coffee/tea, fruits, aluminum foil, ,,,
 ice cream, fruits, juice, shampoo, individual meals, individual meals, butter, cereals, spaghetti sauce, yogurt, sugar, shampoo, sugar, pasta, ,,,,,
 tortillas, juice, milk, soap, dishwashing liquid/detergent, vegetables, beef, ketchup, toilet paper, mixes, sandwich loaves, cheeses, laundry detergent, dishwashing liquid/detergent, cheeses, paper towels, vegetables, all- purpose, yogurt, beef
 coffee/tea, dishwashing liquid/detergent, bagels, butter, pasta, spaghetti sauce, vegetables, all- purpose, coffee/tea, mixes, cereals, spaghetti sauce, bagels, vegetables, fruits, laundry detergent, fruits, ,,
 all- purpose, soap, waffles, vegetables, sandwich loaves, toilet paper, sandwich loaves, yogurt, aluminum foil, vegetables, sandwich loaves, paper towels, toilet paper, dinner rolls, butter, laundry detergent, ketchup, individual meals, coffee/tea, toilet paper
 paper towels, toilet paper, spaghetti sauce, vegetables, spaghetti sauce, waffles, paper towels, cereals, sugar, waffles, waffles, yogurt, sandwich loaves, pasta, pasta, dishwashing liquid/detergent, paper towels, paper towels, cheeses, 
 laundry detergent, vegetables, mixes, flour, individual meals, sandwich loaves, sugar, hand soap, ice cream, poultry, dishwashing liquid/detergent, coffee/tea, vegetables, coffee/tea, spaghetti sauce, vegetables, spaghetti sauce, ,,
 bagels, milk, aluminum foil, spaghetti sauce, individual meals, shampoo, ketchup, juice, ,,,,,,,,,,,
 soda, cheeses, coffee/tea, waffles, aluminum foil, poultry, fruits, vegetables, vegetables, tortillas, ice cream, ,,,,,,,,
 cheeses, hand soap, flour, sandwich bags, cereals, flour, eggs, hand soap, laundry detergent, vegetables, hand soap, sandwich loaves, fruits, ,,,,,,
 vegetables, sandwich loaves, poultry, paper towels, vegetables, coffee/tea, ,,,,,,,,,,,,,
 cheeses, hand soap, paper towels, dinner rolls, all- purpose, milk, vegetables, eggs, sandwich loaves, vegetables, mixes, ice cream, vegetables, hand soap, cereals, aluminum foil, dinner rolls, ,,
 coffee/tea, bagels, hand soap, ketchup, mixes, hand soap, tortillas, sandwich loaves, eggs, ice cream, beef, juice, sandwich loaves, yogurt, spaghetti sauce, milk, soap, sandwich bags, cereals, cheeses
 vegetables, hand soap, tortillas, vegetables, vegetables, sandwich bags, laundry detergent, sugar, eggs, toilet paper, laundry detergent, milk, sandwich bags, lunch meat, waffles, vegetables, vegetables, ,,
 dinner rolls, cereals, ketchup, bagels, soap, butter, cereals, milk, ,,,,,,,,,,,
 ice cream, flour, hand soap, flour, individual meals, paper towels, ice cream, ,,,,,,,,,,,,
 coffee/tea, sugar, juice, juice, individual meals, bagels, poultry, soda, laundry detergent, aluminum foil, aluminum foil, pasta, sandwich bags, sandwich loaves, sugar, pork, shampoo, coffee/tea, vegetables, bagels
 dinner rolls, beef, eggs, laundry detergent, paper towels, hand soap, all- purpose, vegetables, laundry detergent, mixes, yogurt, beef, laundry detergent, cheeses, pasta, waffles, ketchup, vegetables, waffles, cereals
 paper towels, dinner rolls, pork, bagels, tortillas, paper towels, milk, beef, ketchup, vegetables, individual meals, dishwashing liquid/detergent, sandwich bags, soda, hand soap, beef, beef, juice, vegetables, 
 cheeses, individual meals, soda, vegetables, spaghetti sauce, soda, tortillas, ice cream, aluminum foil, bagels, cereals, coffee/tea, ,,,,,,,
 dishwashing liquid/detergent, sandwich loaves, waffles, aluminum foil, pasta, ,,,,,,,,,,,,,,
 aluminum foil, dinner rolls, sugar, ketchup, ,,,,,,,,,,,,,,,
 eggs, soap, sandwich loaves, vegetables, paper towels, soda, yogurt, juice, milk, pork, tortillas, poultry, vegetables, dishwashing liquid/detergent, milk, ,,,,
 hand soap, waffles, waffles, cheeses, yogurt, toilet paper, ,,,,,,,,,,,,,
 ketchup, cheeses, dinner rolls, coffee/tea, all- purpose, dishwashing liquid/detergent, individual meals, paper towels, pasta, ketchup, ,,,,,,,,,
 pasta, paper towels, bagels, vegetables, vegetables, cereals, bagels, all- purpose, milk, beef, soap, coffee/tea, eggs, toilet paper, hand soap, shampoo, sandwich loaves, ,,
 pork, individual meals, milk, bagels, sugar, shampoo, soap, beef, cereals, vegetables, spaghetti sauce, yogurt, lunch meat, milk, ,,,,,
 milk, aluminum foil, coffee/tea, vegetables, shampoo, juice, eggs, dishwashing liquid/detergent, poultry, cereals, paper towels, dinner rolls, pasta, dinner rolls, yogurt, waffles, butter, pork, dishwashing liquid/detergent, aluminum foil
 ice cream, vegetables, waffles, mixes, vegetables, sugar, coffee/tea, poultry, pork, milk, paper towels, shampoo, coffee/tea, butter, flour, all- purpose, flour, cheeses, eggs, 
 dishwashing liquid/detergent, milk, all- purpose, juice, sandwich bags, bagels, pasta, milk, waffles, vegetables, hand soap, toilet paper, eggs, aluminum foil, yogurt, sandwich bags, eggs, ,,
 shampoo, dinner rolls, yogurt, shampoo, cereals, juice, beef, pork, ,,,,,,,,,,,
 butter, sandwich loaves, eggs, butter, lunch meat, all- purpose, lunch meat, flour, mixes, yogurt, sandwich bags, cheeses, mixes, bagels, spaghetti sauce, individual meals, waffles, dishwashing liquid/detergent, dinner rolls, fruits
 paper towels, juice, beef, butter, toilet paper, yogurt, laundry detergent, dishwashing liquid/detergent, toilet paper, fruits, dishwashing liquid/detergent, juice, vegetables, milk, butter, paper towels, laundry detergent, ice cream, ,
 dishwashing liquid/detergent, yogurt, cheeses, soda, flour, pork, flour, vegetables, sugar, fruits, tortillas, waffles, dinner rolls, bagels, eggs, dishwashing liquid/detergent, vegetables, ,,
 milk, paper towels, flour, laundry detergent, laundry detergent, toilet paper, poultry, coffee/tea, beef, bagels, ,,,,,,,,,
 flour, fruits, soda, milk, dinner rolls, eggs, individual meals, paper towels, mixes, waffles, pasta, dishwashing liquid/detergent, coffee/tea, lunch meat, toilet paper, laundry detergent, sandwich loaves, dinner rolls, flour, butter
 vegetables, ice cream, ketchup, laundry detergent, toilet paper, mixes, shampoo, pork, vegetables, sandwich bags, tortillas, eggs, pasta, sugar, butter, laundry detergent, aluminum foil, all- purpose, toilet paper, 
 juice, dinner rolls, individual meals, shampoo, sandwich bags, soap, shampoo, vegetables, paper towels, milk, poultry, cereals, beef, paper towels, vegetables, milk, aluminum foil, cereals, eggs, sandwich bags
 hand soap, bagels, dishwashing liquid/detergent, waffles, beef, poultry, mixes, laundry detergent, individual meals, bagels, ,,,,,,,,,
